InvoiceNo,StockCode,Description,Quantity,InvoiceDate,UnitPrice,CustomerID,Country
541258,22423,REGENCY CAKESTAND 3 TIER,1,1/16/2011 15:30,12.75,13634,United Kingdom
541258,22900, SET 2 TEA TOWELS I LOVE LONDON ,2,1/16/2011 15:30,2.95,13634,United Kingdom
541258,21355,TOAST ITS - I LOVE YOU ,4,1/16/2011 15:30,1.25,13634,United Kingdom
541258,22914,BLUE COAT RACK PARIS FASHION,1,1/16/2011 15:30,4.95,13634,United Kingdom
541258,22913,RED COAT RACK PARIS FASHION,1,1/16/2011 15:30,4.95,13634,United Kingdom
541258,22912,YELLOW COAT RACK PARIS FASHION,1,1/16/2011 15:30,4.95,13634,United Kingdom
541258,22795,SWEETHEART RECIPE BOOK STAND,3,1/16/2011 15:30,6.75,13634,United Kingdom
541258,82483,WOOD 2 DRAWER CABINET WHITE FINISH,2,1/16/2011 15:30,5.95,13634,United Kingdom
541258,82486,WOOD S/3 CABINET ANT WHITE FINISH,2,1/16/2011 15:30,7.95,13634,United Kingdom
541258,82483,WOOD 2 DRAWER CABINET WHITE FINISH,2,1/16/2011 15:30,5.95,13634,United Kingdom
541258,82486,WOOD S/3 CABINET ANT WHITE FINISH,2,1/16/2011 15:30,7.95,13634,United Kingdom
541258,22988,SOLDIERS EGG CUP ,12,1/16/2011 15:30,1.25,13634,United Kingdom
541259,20727,LUNCH BAG  BLACK SKULL.,10,1/16/2011 15:38,1.65,14404,United Kingdom
541259,22662,LUNCH BAG DOLLY GIRL DESIGN,10,1/16/2011 15:38,1.65,14404,United Kingdom
541259,22375,AIRLINE BAG VINTAGE JET SET BROWN,1,1/16/2011 15:38,4.25,14404,United Kingdom
541259,22371,AIRLINE BAG VINTAGE TOKYO 78,1,1/16/2011 15:38,4.25,14404,United Kingdom
541259,48184,DOORMAT ENGLISH ROSE ,1,1/16/2011 15:38,7.95,14404,United Kingdom
541259,20725,LUNCH BAG RED RETROSPOT,10,1/16/2011 15:38,1.65,14404,United Kingdom
541259,20727,LUNCH BAG  BLACK SKULL.,10,1/16/2011 15:38,1.65,14404,United Kingdom
541259,22423,REGENCY CAKESTAND 3 TIER,3,1/16/2011 15:38,12.75,14404,United Kingdom
541259,21955,DOORMAT UNION JACK GUNS AND ROSES,1,1/16/2011 15:38,7.95,14404,United Kingdom
541259,20726,LUNCH BAG WOODLAND,10,1/16/2011 15:38,1.65,14404,United Kingdom
541259,84050,PINK HEART SHAPE EGG FRYING PAN,8,1/16/2011 15:38,1.65,14404,United Kingdom
541259,84378,SET OF 3 HEART COOKIE CUTTERS,1,1/16/2011 15:38,1.25,14404,United Kingdom
541259,22376,AIRLINE BAG VINTAGE JET SET WHITE,1,1/16/2011 15:38,4.25,14404,United Kingdom
541259,22374,AIRLINE BAG VINTAGE JET SET RED,2,1/16/2011 15:38,4.25,14404,United Kingdom
541259,22384,LUNCH BAG PINK POLKADOT,10,1/16/2011 15:38,1.65,14404,United Kingdom
541259,22371,AIRLINE BAG VINTAGE TOKYO 78,1,1/16/2011 15:38,4.25,14404,United Kingdom
541259,84378,SET OF 3 HEART COOKIE CUTTERS,2,1/16/2011 15:38,1.25,14404,United Kingdom
541259,21631,HIPPY CHIC DECORATIVE PARASOL,12,1/16/2011 15:38,3.95,14404,United Kingdom
541259,22476,EMPIRE UNION JACK TV DINNER TRAY,8,1/16/2011 15:38,4.95,14404,United Kingdom
541260,22907,PACK OF 20 NAPKINS PANTRY DESIGN,1,1/16/2011 15:44,0.85,16059,United Kingdom
541260,22916,HERB MARKER THYME,4,1/16/2011 15:44,0.65,16059,United Kingdom
541260,22920,HERB MARKER BASIL,4,1/16/2011 15:44,0.65,16059,United Kingdom
541260,22917,HERB MARKER ROSEMARY,4,1/16/2011 15:44,0.65,16059,United Kingdom
541260,22919,HERB MARKER MINT,4,1/16/2011 15:44,0.65,16059,United Kingdom
541260,22918,HERB MARKER PARSLEY,4,1/16/2011 15:44,0.65,16059,United Kingdom
541260,22967,SET 3 SONG BIRD PAPER EGGS ASSORTED,1,1/16/2011 15:44,2.95,16059,United Kingdom
541260,22957,SET 3 PAPER VINTAGE CHICK PAPER EGG,1,1/16/2011 15:44,2.95,16059,United Kingdom
541260,22241,GARLAND WOODEN HAPPY EASTER,4,1/16/2011 15:44,1.25,16059,United Kingdom
541260,22072,RED RETROSPOT TEA CUP AND SAUCER ,1,1/16/2011 15:44,3.75,16059,United Kingdom
541260,22934,BAKING MOULD EASTER EGG WHITE CHOC,3,1/16/2011 15:44,2.95,16059,United Kingdom
541260,85094,CANDY SPOT EGG WARMER RABBIT,2,1/16/2011 15:44,1.25,16059,United Kingdom
541260,22720,SET OF 3 CAKE TINS PANTRY DESIGN ,2,1/16/2011 15:44,4.95,16059,United Kingdom
541260,22469,HEART OF WICKER SMALL,6,1/16/2011 15:44,1.65,16059,United Kingdom
541260,22470,HEART OF WICKER LARGE,2,1/16/2011 15:44,2.95,16059,United Kingdom
541260,22822,CREAM WALL PLANTER HEART SHAPED,1,1/16/2011 15:44,5.95,16059,United Kingdom
541260,22962,JAM JAR WITH PINK LID,1,1/16/2011 15:44,0.85,16059,United Kingdom
541260,22963,JAM JAR WITH GREEN LID,1,1/16/2011 15:44,0.85,16059,United Kingdom
541260,22078,RIBBON REEL LACE DESIGN ,1,1/16/2011 15:44,2.1,16059,United Kingdom
541260,84375,SET OF 20 KIDS COOKIE CUTTERS,3,1/16/2011 15:44,2.1,16059,United Kingdom
541260,22766,PHOTO FRAME CORNICE,2,1/16/2011 15:44,2.95,16059,United Kingdom
541260,22907,PACK OF 20 NAPKINS PANTRY DESIGN,2,1/16/2011 15:44,0.85,16059,United Kingdom
541260,22961,JAM MAKING SET PRINTED,7,1/16/2011 15:44,1.45,16059,United Kingdom
541260,22078,RIBBON REEL LACE DESIGN ,2,1/16/2011 15:44,2.1,16059,United Kingdom
541260,21535,RED RETROSPOT SMALL MILK JUG,2,1/16/2011 15:44,2.55,16059,United Kingdom
541260,22722,SET OF 6 SPICE TINS PANTRY DESIGN,2,1/16/2011 15:44,3.95,16059,United Kingdom
541260,22072,RED RETROSPOT TEA CUP AND SAUCER ,1,1/16/2011 15:44,3.75,16059,United Kingdom
541260,21324,HANGING MEDINA LANTERN SMALL,1,1/16/2011 15:44,2.95,16059,United Kingdom
541260,22666,RECIPE BOX PANTRY YELLOW DESIGN,2,1/16/2011 15:44,2.95,16059,United Kingdom
541260,20914,SET/5 RED RETROSPOT LID GLASS BOWLS,2,1/16/2011 15:44,2.95,16059,United Kingdom
541260,22829,SWEETHEART WIRE WALL TIDY,1,1/16/2011 15:44,9.95,16059,United Kingdom
C541261,22476,EMPIRE UNION JACK TV DINNER TRAY,-8,1/16/2011 15:48,4.95,14404,United Kingdom
541262,21463,MIRRORED DISCO BALL ,1,1/16/2011 15:50,5.95,18069,United Kingdom
541262,21755,LOVE BUILDING BLOCK WORD,1,1/16/2011 15:50,5.95,18069,United Kingdom
541262,22241,GARLAND WOODEN HAPPY EASTER,2,1/16/2011 15:50,1.25,18069,United Kingdom
541262,22241,GARLAND WOODEN HAPPY EASTER,2,1/16/2011 15:50,1.25,18069,United Kingdom
541262,22759,SET OF 3 NOTEBOOKS IN PARCEL,1,1/16/2011 15:50,1.65,18069,United Kingdom
541262,21381,MINI WOODEN HAPPY BIRTHDAY GARLAND,2,1/16/2011 15:50,1.69,18069,United Kingdom
541262,85038,6 CHOCOLATE LOVE HEART T-LIGHTS,2,1/16/2011 15:50,2.1,18069,United Kingdom
541262,21937,STRAWBERRY   PICNIC BAG,2,1/16/2011 15:50,2.95,18069,United Kingdom
541262,22665,RECIPE BOX BLUE SKETCHBOOK DESIGN,1,1/16/2011 15:50,2.95,18069,United Kingdom
541262,22667,RECIPE BOX RETROSPOT ,1,1/16/2011 15:50,2.95,18069,United Kingdom
541262,84970L,SINGLE HEART ZINC T-LIGHT HOLDER,3,1/16/2011 15:50,0.95,18069,United Kingdom
541262,84970S,HANGING HEART ZINC T-LIGHT HOLDER,6,1/16/2011 15:50,0.85,18069,United Kingdom
541262,75131,METAL TUBE CHIME ON BAMBOO,1,1/16/2011 15:50,1.69,18069,United Kingdom
541262,84509A,SET OF 4 ENGLISH ROSE PLACEMATS,2,1/16/2011 15:50,3.75,18069,United Kingdom
541262,22335,HEART DECORATION PAINTED ZINC ,2,1/16/2011 15:50,0.65,18069,United Kingdom
541262,22296,HEART IVORY TRELLIS LARGE,2,1/16/2011 15:50,1.65,18069,United Kingdom
541262,84836,ZINC METAL HEART DECORATION,4,1/16/2011 15:50,1.25,18069,United Kingdom
541262,22162,HEART GARLAND RUSTIC PADDED,1,1/16/2011 15:50,2.95,18069,United Kingdom
541262,21714,CITRONELLA CANDLE GARDEN POT,2,1/16/2011 15:50,1.25,18069,United Kingdom
541262,22548,HEADS AND TAILS SPORTING FUN,1,1/16/2011 15:50,1.25,18069,United Kingdom
541262,85061W,WHITE JEWELLED HEART DECORATION,2,1/16/2011 15:50,0.85,18069,United Kingdom
541262,10002,INFLATABLE POLITICAL GLOBE ,6,1/16/2011 15:50,0.85,18069,United Kingdom
541262,82580,BATHROOM METAL SIGN,1,1/16/2011 15:50,0.55,18069,United Kingdom
541262,82581,TOILET METAL SIGN,1,1/16/2011 15:50,0.55,18069,United Kingdom
541262,22811,SET OF 6 T-LIGHTS CACTI ,1,1/16/2011 15:50,2.95,18069,United Kingdom
541262,72351B,SET/6 PINK  BUTTERFLY T-LIGHTS,1,1/16/2011 15:50,2.1,18069,United Kingdom
541262,72807B,SET/3 OCEAN SCENT CANDLE JEWEL BOX,1,1/16/2011 15:50,4.25,18069,United Kingdom
541262,72807A,SET/3 ROSE CANDLE IN JEWELLED BOX,1,1/16/2011 15:50,4.25,18069,United Kingdom
541262,72807C,SET/3 VANILLA SCENTED CANDLE IN BOX,1,1/16/2011 15:50,4.25,18069,United Kingdom
541262,72351B,SET/6 PINK  BUTTERFLY T-LIGHTS,1,1/16/2011 15:50,2.1,18069,United Kingdom
541262,22460,EMBOSSED GLASS TEALIGHT HOLDER,2,1/16/2011 15:50,1.25,18069,United Kingdom
541262,84950,ASSORTED COLOUR T-LIGHT HOLDER,6,1/16/2011 15:50,0.65,18069,United Kingdom
541262,79066K,RETRO MOD TRAY,4,1/16/2011 15:50,0.85,18069,United Kingdom
541262,22755,SMALL PURPLE BABUSHKA NOTEBOOK ,2,1/16/2011 15:50,0.85,18069,United Kingdom
541262,22860,EASTER TIN CHICKS PINK DAISY,3,1/16/2011 15:50,1.65,18069,United Kingdom
541262,22789,T-LIGHT HOLDER SWEETHEART HANGING,2,1/16/2011 15:50,1.95,18069,United Kingdom
541262,35921,EASTER BUNNY HANGING GARLAND,2,1/16/2011 15:50,1.25,18069,United Kingdom
541262,79321,CHILLI LIGHTS,6,1/16/2011 15:50,4.95,18069,United Kingdom
541262,22035,VINTAGE CARAVAN GREETING CARD ,12,1/16/2011 15:50,0.42,18069,United Kingdom
541262,22549,PICTURE DOMINOES,1,1/16/2011 15:50,1.45,18069,United Kingdom
541262,22807,SET OF 6 T-LIGHTS TOADSTOOLS,1,1/16/2011 15:50,2.95,18069,United Kingdom
541262,85206B,PINK FELT EASTER EGG BASKET,1,1/16/2011 15:50,1.65,18069,United Kingdom
541262,22021,BLUE FELT EASTER EGG BASKET,1,1/16/2011 15:50,1.65,18069,United Kingdom
541262,85206A,CREAM FELT EASTER EGG BASKET,3,1/16/2011 15:50,1.65,18069,United Kingdom
541262,21219,SET/4 BADGES BALLOON GIRL,10,1/16/2011 15:50,1.25,18069,United Kingdom
541262,21705,BAG 500g SWIRLY MARBLES,2,1/16/2011 15:50,1.65,18069,United Kingdom
541262,21464,DISCO BALL ROTATOR BATTERY OPERATED,1,1/16/2011 15:50,4.25,18069,United Kingdom
541262,21790,VINTAGE SNAP CARDS,2,1/16/2011 15:50,0.85,18069,United Kingdom
541262,21889,WOODEN BOX OF DOMINOES,1,1/16/2011 15:50,1.25,18069,United Kingdom
541262,22435,SET OF 9 HEART SHAPED BALLOONS,1,1/16/2011 15:50,1.25,18069,United Kingdom
541262,22621,TRADITIONAL KNITTING NANCY,2,1/16/2011 15:50,1.45,18069,United Kingdom
541262,21891,TRADITIONAL WOODEN SKIPPING ROPE,2,1/16/2011 15:50,1.25,18069,United Kingdom
541262,21892,TRADITIONAL WOODEN CATCH CUP GAME ,2,1/16/2011 15:50,1.25,18069,United Kingdom
541262,22620,4 TRADITIONAL SPINNING TOPS,2,1/16/2011 15:50,1.25,18069,United Kingdom
541262,21430,SET/3 RED GINGHAM ROSE STORAGE BOX,1,1/16/2011 15:50,3.75,18069,United Kingdom
541262,85064,CREAM SWEETHEART LETTER RACK,1,1/16/2011 15:50,5.45,18069,United Kingdom
541262,21755,LOVE BUILDING BLOCK WORD,1,1/16/2011 15:50,5.95,18069,United Kingdom
541262,22148,EASTER CRAFT 4 CHICKS ,2,1/16/2011 15:50,1.95,18069,United Kingdom
541262,82482,WOODEN PICTURE FRAME WHITE FINISH,1,1/16/2011 15:50,2.55,18069,United Kingdom
541262,22831,WHITE BROCANTE SOAP DISH,1,1/16/2011 15:50,2.95,18069,United Kingdom
541262,22863,SOAP DISH BROCANTE,1,1/16/2011 15:50,2.95,18069,United Kingdom
541262,82567,"AIRLINE LOUNGE,METAL SIGN",1,1/16/2011 15:50,2.1,18069,United Kingdom
541262,85038,6 CHOCOLATE LOVE HEART T-LIGHTS,1,1/16/2011 15:50,2.1,18069,United Kingdom
541262,20727,LUNCH BAG  BLACK SKULL.,1,1/16/2011 15:50,1.65,18069,United Kingdom
541262,20725,LUNCH BAG RED RETROSPOT,2,1/16/2011 15:50,1.65,18069,United Kingdom
541262,22384,LUNCH BAG PINK POLKADOT,2,1/16/2011 15:50,1.65,18069,United Kingdom
541262,84050,PINK HEART SHAPE EGG FRYING PAN,4,1/16/2011 15:50,1.65,18069,United Kingdom
541262,85123A,WHITE HANGING HEART T-LIGHT HOLDER,1,1/16/2011 15:50,2.95,18069,United Kingdom
541262,21733,RED HANGING HEART T-LIGHT HOLDER,1,1/16/2011 15:50,2.95,18069,United Kingdom
541262,21355,TOAST ITS - I LOVE YOU ,2,1/16/2011 15:50,1.25,18069,United Kingdom
541262,22766,PHOTO FRAME CORNICE,2,1/16/2011 15:50,2.95,18069,United Kingdom
541262,22469,HEART OF WICKER SMALL,4,1/16/2011 15:50,1.65,18069,United Kingdom
541262,22470,HEART OF WICKER LARGE,1,1/16/2011 15:50,2.95,18069,United Kingdom
541262,84949,SILVER HANGING T-LIGHT HOLDER,2,1/16/2011 15:50,1.65,18069,United Kingdom
541262,84760S,SMALL HANGING GLASS+ZINC LANTERN,2,1/16/2011 15:50,1.45,18069,United Kingdom
541262,22752,SET 7 BABUSHKA NESTING BOXES,2,1/16/2011 15:50,8.5,18069,United Kingdom
541263,22242,5 HOOK HANGER MAGIC TOADSTOOL,24,1/16/2011 16:10,1.65,16843,United Kingdom
541263,20971,PINK BLUE FELT CRAFT TRINKET BOX,36,1/16/2011 16:10,1.25,16843,United Kingdom
541263,22570,FELTCRAFT CUSHION RABBIT,12,1/16/2011 16:10,3.75,16843,United Kingdom
541263,22568,FELTCRAFT CUSHION OWL,12,1/16/2011 16:10,3.75,16843,United Kingdom
541263,37448,CERAMIC CAKE DESIGN SPOTTED MUG,24,1/16/2011 16:10,1.49,16843,United Kingdom
541263,22358,KINGS CHOICE TEA CADDY ,6,1/16/2011 16:10,2.95,16843,United Kingdom
541263,20914,SET/5 RED RETROSPOT LID GLASS BOWLS,24,1/16/2011 16:10,2.95,16843,United Kingdom
541263,22960,JAM MAKING SET WITH JARS,12,1/16/2011 16:10,3.75,16843,United Kingdom
541263,22961,JAM MAKING SET PRINTED,24,1/16/2011 16:10,1.45,16843,United Kingdom
541263,22720,SET OF 3 CAKE TINS PANTRY DESIGN ,6,1/16/2011 16:10,4.95,16843,United Kingdom
541263,22722,SET OF 6 SPICE TINS PANTRY DESIGN,8,1/16/2011 16:10,3.95,16843,United Kingdom
541263,22964,3 PIECE SPACEBOY COOKIE CUTTER SET,24,1/16/2011 16:10,2.1,16843,United Kingdom
541263,22721,SET OF 3 CAKE TINS SKETCHBOOK,6,1/16/2011 16:10,4.95,16843,United Kingdom
541263,22723,SET OF 6 HERB TINS SKETCHBOOK,4,1/16/2011 16:10,3.95,16843,United Kingdom
541263,21213,PACK OF 72 SKULL CAKE CASES,120,1/16/2011 16:10,0.42,16843,United Kingdom
541263,84991,60 TEATIME FAIRY CAKE CASES,120,1/16/2011 16:10,0.42,16843,United Kingdom
541263,22666,RECIPE BOX PANTRY YELLOW DESIGN,6,1/16/2011 16:10,2.95,16843,United Kingdom
541263,22665,RECIPE BOX BLUE SKETCHBOOK DESIGN,6,1/16/2011 16:10,2.95,16843,United Kingdom
541263,22969,HOMEMADE JAM SCENTED CANDLES,60,1/16/2011 16:10,1.45,16843,United Kingdom
541264,22508,DOORSTOP RETROSPOT HEART,2,1/16/2011 16:10,3.75,17064,United Kingdom
541264,21115,ROSE CARAVAN DOORSTOP,2,1/16/2011 16:10,6.75,17064,United Kingdom
541264,21928,JUMBO BAG SCANDINAVIAN PAISLEY,2,1/16/2011 16:10,1.95,17064,United Kingdom
541264,85206A,CREAM FELT EASTER EGG BASKET,6,1/16/2011 16:10,1.65,17064,United Kingdom
541264,22090,PAPER BUNTING RETROSPOT,5,1/16/2011 16:10,2.95,17064,United Kingdom
541264,22272,FELTCRAFT DOLL MARIA,1,1/16/2011 16:10,2.95,17064,United Kingdom
541264,22271,FELTCRAFT DOLL ROSIE,1,1/16/2011 16:10,2.95,17064,United Kingdom
541264,22274,FELTCRAFT DOLL EMILY,1,1/16/2011 16:10,2.95,17064,United Kingdom
541264,22273,FELTCRAFT DOLL MOLLY,1,1/16/2011 16:10,2.95,17064,United Kingdom
541264,22148,EASTER CRAFT 4 CHICKS ,3,1/16/2011 16:10,1.95,17064,United Kingdom
541264,22457,NATURAL SLATE HEART CHALKBOARD ,3,1/16/2011 16:10,2.95,17064,United Kingdom
541264,22720,SET OF 3 CAKE TINS PANTRY DESIGN ,3,1/16/2011 16:10,4.95,17064,United Kingdom
541264,21592,RETROSPOT CIGAR BOX MATCHES ,3,1/16/2011 16:10,1.25,17064,United Kingdom
541264,21985,PACK OF 12 HEARTS DESIGN TISSUES ,12,1/16/2011 16:10,0.29,17064,United Kingdom
541264,21584,RETROSPOT SMALL TUBE MATCHES,3,1/16/2011 16:10,1.65,17064,United Kingdom
541264,85174,S/4 CACTI CANDLES,1,1/16/2011 16:10,4.95,17064,United Kingdom
541264,22624,IVORY KITCHEN SCALES,1,1/16/2011 16:10,8.5,17064,United Kingdom
541264,85175,CACTI T-LIGHT CANDLES,16,1/16/2011 16:10,0.42,17064,United Kingdom
541264,22386,JUMBO BAG PINK POLKADOT,3,1/16/2011 16:10,1.95,17064,United Kingdom
541264,22457,NATURAL SLATE HEART CHALKBOARD ,1,1/16/2011 16:10,2.95,17064,United Kingdom
541264,22722,SET OF 6 SPICE TINS PANTRY DESIGN,1,1/16/2011 16:10,3.95,17064,United Kingdom
541264,22366,DOORMAT AIRMAIL ,1,1/16/2011 16:10,7.95,17064,United Kingdom
541264,21928,JUMBO BAG SCANDINAVIAN PAISLEY,2,1/16/2011 16:10,1.95,17064,United Kingdom
541265,20711,JUMBO BAG TOYS ,2,1/16/2011 16:23,1.95,17609,United Kingdom
541265,M,Manual,2,1/16/2011 16:23,1.25,17609,United Kingdom
541265,20713,JUMBO BAG OWLS,2,1/16/2011 16:23,1.95,17609,United Kingdom
541265,21935,SUKI  SHOULDER BAG,2,1/16/2011 16:23,1.65,17609,United Kingdom
541265,20726,LUNCH BAG WOODLAND,1,1/16/2011 16:23,1.65,17609,United Kingdom
541265,22661,CHARLOTTE BAG DOLLY GIRL DESIGN,2,1/16/2011 16:23,0.85,17609,United Kingdom
541265,22383,LUNCH BAG SUKI  DESIGN ,2,1/16/2011 16:23,1.65,17609,United Kingdom
541265,22355,CHARLOTTE BAG SUKI DESIGN,4,1/16/2011 16:23,0.85,17609,United Kingdom
541265,20723,STRAWBERRY CHARLOTTE BAG,5,1/16/2011 16:23,0.85,17609,United Kingdom
541265,22380,TOY TIDY SPACEBOY  ,8,1/16/2011 16:23,2.1,17609,United Kingdom
541265,20717,STRAWBERRY SHOPPER BAG,6,1/16/2011 16:23,1.25,17609,United Kingdom
541265,84457,SET/3 RABBITS FLOWER SKIPPPING ROPE,2,1/16/2011 16:23,0.85,17609,United Kingdom
541265,20832,RED FLOCK LOVE HEART PHOTO FRAME,4,1/16/2011 16:23,0.85,17609,United Kingdom
541265,47503H,ASS FLORAL PRINT SPIRIT LEVEL ,2,1/16/2011 16:23,1.95,17609,United Kingdom
541265,47504K,ENGLISH ROSE GARDEN SECATEURS,2,1/16/2011 16:23,1.95,17609,United Kingdom
541265,20712,JUMBO BAG WOODLAND ANIMALS,3,1/16/2011 16:23,1.95,17609,United Kingdom
541265,85200,BUNNY EGG BOX,2,1/16/2011 16:23,1.25,17609,United Kingdom
541265,20711,JUMBO BAG TOYS ,3,1/16/2011 16:23,1.95,17609,United Kingdom
541265,21931,JUMBO STORAGE BAG SUKI,4,1/16/2011 16:23,1.95,17609,United Kingdom
541265,22448,PIN CUSHION BABUSHKA RED,2,1/16/2011 16:23,3.35,17609,United Kingdom
541265,47503A,ASS FLORAL PRINT MULTI SCREWDRIVER,2,1/16/2011 16:23,1.25,17609,United Kingdom
541265,22667,RECIPE BOX RETROSPOT ,1,1/16/2011 16:23,2.95,17609,United Kingdom
541265,20679,EDWARDIAN PARASOL RED,1,1/16/2011 16:23,5.95,17609,United Kingdom
541265,22452,MEASURING TAPE BABUSHKA PINK,2,1/16/2011 16:23,2.95,17609,United Kingdom
541265,22164,STRING OF STARS CARD HOLDER,1,1/16/2011 16:23,2.95,17609,United Kingdom
541265,22163,HEART STRING MEMO HOLDER HANGING,3,1/16/2011 16:23,2.95,17609,United Kingdom
541265,85066,CREAM SWEETHEART MINI CHEST,1,1/16/2011 16:23,12.75,17609,United Kingdom
541265,22079,RIBBON REEL HEARTS DESIGN ,5,1/16/2011 16:23,1.65,17609,United Kingdom
541265,22774,RED DRAWER KNOB ACRYLIC EDWARDIAN,4,1/16/2011 16:23,1.25,17609,United Kingdom
541265,22382,LUNCH BAG SPACEBOY DESIGN ,2,1/16/2011 16:23,1.65,17609,United Kingdom
541265,22661,CHARLOTTE BAG DOLLY GIRL DESIGN,1,1/16/2011 16:23,0.85,17609,United Kingdom
541265,20726,LUNCH BAG WOODLAND,1,1/16/2011 16:23,1.65,17609,United Kingdom
541265,22662,LUNCH BAG DOLLY GIRL DESIGN,2,1/16/2011 16:23,1.65,17609,United Kingdom
541265,21928,JUMBO BAG SCANDINAVIAN PAISLEY,3,1/16/2011 16:23,1.95,17609,United Kingdom
541265,21929,JUMBO BAG PINK VINTAGE PAISLEY,3,1/16/2011 16:23,1.95,17609,United Kingdom
541265,85099F,JUMBO BAG STRAWBERRY,3,1/16/2011 16:23,1.95,17609,United Kingdom
541265,85099C,JUMBO  BAG BAROQUE BLACK WHITE,3,1/16/2011 16:23,1.95,17609,United Kingdom
541265,85099C,JUMBO  BAG BAROQUE BLACK WHITE,2,1/16/2011 16:23,1.95,17609,United Kingdom
541265,20727,LUNCH BAG  BLACK SKULL.,2,1/16/2011 16:23,1.65,17609,United Kingdom
541265,22470,HEART OF WICKER LARGE,2,1/16/2011 16:23,2.95,17609,United Kingdom
541265,21755,LOVE BUILDING BLOCK WORD,1,1/16/2011 16:23,5.95,17609,United Kingdom
541265,21733,RED HANGING HEART T-LIGHT HOLDER,1,1/16/2011 16:23,2.95,17609,United Kingdom
541265,16207B,PINK HEART RED HANDBAG,1,1/16/2011 16:23,2.95,17609,United Kingdom
541265,22508,DOORSTOP RETROSPOT HEART,1,1/16/2011 16:23,3.75,17609,United Kingdom
541265,22505,MEMO BOARD COTTAGE DESIGN,1,1/16/2011 16:23,4.95,17609,United Kingdom
541265,22487,WHITE WOOD GARDEN PLANT LADDER,2,1/16/2011 16:23,9.95,17609,United Kingdom
541265,85114A,BLACK ENCHANTED FOREST PLACEMAT,4,1/16/2011 16:23,1.65,17609,United Kingdom
541265,22354,RETROSPOT PADDED SEAT CUSHION,2,1/16/2011 16:23,3.75,17609,United Kingdom
541265,21620,SET OF 4 ROSE BOTANICAL CANDLES,2,1/16/2011 16:23,3.75,17609,United Kingdom
541265,85025C,PINK HEART SHAPE PHOTO FRAME,1,1/16/2011 16:23,1.65,17609,United Kingdom
541265,85025C,PINK HEART SHAPE PHOTO FRAME,1,1/16/2011 16:23,1.65,17609,United Kingdom
541265,35095B,RED VICTORIAN FABRIC OVAL BOX,12,1/16/2011 16:23,0.42,17609,United Kingdom
541265,22224,WHITE LOVEBIRD LANTERN,1,1/16/2011 16:23,2.95,17609,United Kingdom
541265,22759,SET OF 3 NOTEBOOKS IN PARCEL,2,1/16/2011 16:23,1.65,17609,United Kingdom
541265,22469,HEART OF WICKER SMALL,3,1/16/2011 16:23,1.65,17609,United Kingdom
541265,22625,RED KITCHEN SCALES,1,1/16/2011 16:23,8.5,17609,United Kingdom
541265,22968,ROSE COTTAGE KEEPSAKE BOX ,1,1/16/2011 16:23,9.95,17609,United Kingdom
541265,22196,SMALL HEART MEASURING SPOONS,1,1/16/2011 16:23,0.85,17609,United Kingdom
541265,20985,HEART CALCULATOR,2,1/16/2011 16:23,1.25,17609,United Kingdom
541265,22134,MINI LADLE LOVE HEART RED ,3,1/16/2011 16:23,0.42,17609,United Kingdom
541265,22352,LUNCH BOX WITH CUTLERY RETROSPOT ,1,1/16/2011 16:23,2.55,17609,United Kingdom
541265,22195,LARGE HEART MEASURING SPOONS,1,1/16/2011 16:23,1.65,17609,United Kingdom
541265,22132,RED LOVE HEART SHAPE CUP,2,1/16/2011 16:23,0.85,17609,United Kingdom
541265,21558,SKULL LUNCH BOX WITH CUTLERY ,1,1/16/2011 16:23,2.55,17609,United Kingdom
541265,22957,SET 3 PAPER VINTAGE CHICK PAPER EGG,2,1/16/2011 16:23,2.95,17609,United Kingdom
541265,22967,SET 3 SONG BIRD PAPER EGGS ASSORTED,1,1/16/2011 16:23,2.95,17609,United Kingdom
541265,84459A,PINK METAL CHICKEN HEART ,1,1/16/2011 16:23,1.49,17609,United Kingdom
541265,84231,EASTER BUNNY WITH BASKET ON BACK,1,1/16/2011 16:23,0.65,17609,United Kingdom
541265,22287,"DECORATION , WOBBLY CHICKEN, METAL ",1,1/16/2011 16:23,1.65,17609,United Kingdom
541265,22243,5 HOOK HANGER RED MAGIC TOADSTOOL,1,1/16/2011 16:23,1.65,17609,United Kingdom
541265,22244,3 HOOK HANGER MAGIC GARDEN,2,1/16/2011 16:23,1.95,17609,United Kingdom
541265,22242,5 HOOK HANGER MAGIC TOADSTOOL,3,1/16/2011 16:23,1.65,17609,United Kingdom
541265,85114C,RED ENCHANTED FOREST PLACEMAT,1,1/16/2011 16:23,1.65,17609,United Kingdom
541265,21460,GREEN EASTER EGG HUNT START POST,1,1/16/2011 16:23,1.95,17609,United Kingdom
541265,21461,BLUE EASTER EGG HUNT START POST,5,1/16/2011 16:23,1.95,17609,United Kingdom
541265,22892,SET OF SALT AND PEPPER TOADSTOOLS,3,1/16/2011 16:23,1.25,17609,United Kingdom
541265,85114C,RED ENCHANTED FOREST PLACEMAT,4,1/16/2011 16:23,1.65,17609,United Kingdom
541265,84231,EASTER BUNNY WITH BASKET ON BACK,2,1/16/2011 16:23,0.65,17609,United Kingdom
541265,21154,RED RETROSPOT OVEN GLOVE ,2,1/16/2011 16:23,1.25,17609,United Kingdom
541265,22250,DECORATION  BUTTERFLY  MAGIC GARDEN,3,1/16/2011 16:23,0.85,17609,United Kingdom
541265,22268,EASTER DECORATION SITTING BUNNY,1,1/16/2011 16:23,0.85,17609,United Kingdom
541265,21439,BASKET OF TOADSTOOLS,4,1/16/2011 16:23,1.25,17609,United Kingdom
541265,22268,EASTER DECORATION SITTING BUNNY,2,1/16/2011 16:23,0.85,17609,United Kingdom
541265,22267,EASTER DECORATION EGG BUNNY ,2,1/16/2011 16:23,1.25,17609,United Kingdom
541265,21358,TOAST ITS - HAPPY BIRTHDAY,2,1/16/2011 16:23,1.25,17609,United Kingdom
541265,21355,TOAST ITS - I LOVE YOU ,3,1/16/2011 16:23,1.25,17609,United Kingdom
541265,22266,EASTER DECORATION HANGING BUNNY,3,1/16/2011 16:23,0.65,17609,United Kingdom
541265,22287,"DECORATION , WOBBLY CHICKEN, METAL ",1,1/16/2011 16:23,1.65,17609,United Kingdom
541265,84032B,CHARLIE + LOLA RED HOT WATER BOTTLE,1,1/16/2011 16:23,2.95,17609,United Kingdom
541265,84406B,CREAM CUPID HEARTS COAT HANGER,3,1/16/2011 16:23,3.25,17609,United Kingdom
541265,22212,FOUR HOOK  WHITE LOVEBIRDS,3,1/16/2011 16:23,2.1,17609,United Kingdom
541265,21485,RETROSPOT HEART HOT WATER BOTTLE,1,1/16/2011 16:23,4.95,17609,United Kingdom
541265,22267,EASTER DECORATION EGG BUNNY ,1,1/16/2011 16:23,1.25,17609,United Kingdom
541265,84459A,PINK METAL CHICKEN HEART ,1,1/16/2011 16:23,1.49,17609,United Kingdom
541265,84459B,YELLOW METAL CHICKEN HEART ,4,1/16/2011 16:23,1.49,17609,United Kingdom
541265,22241,GARLAND WOODEN HAPPY EASTER,3,1/16/2011 16:23,1.25,17609,United Kingdom
541265,21563,RED HEART SHAPE LOVE BUCKET ,1,1/16/2011 16:23,2.95,17609,United Kingdom
541265,84462,3 PINK HEN+CHICKS IN BASKET,2,1/16/2011 16:23,1.25,17609,United Kingdom
541265,84461,12 PINK HEN+CHICKS IN BASKET,1,1/16/2011 16:23,2.55,17609,United Kingdom
541265,35922,EASTER BUNNY WREATH,1,1/16/2011 16:23,4.95,17609,United Kingdom
541266,22385,JUMBO BAG SPACEBOY DESIGN,10,1/16/2011 16:25,1.95,15673,United Kingdom
541266,21929,JUMBO BAG PINK VINTAGE PAISLEY,10,1/16/2011 16:25,1.95,15673,United Kingdom
541266,21928,JUMBO BAG SCANDINAVIAN PAISLEY,10,1/16/2011 16:25,1.95,15673,United Kingdom
541266,21383,PACK OF 12 STICKY BUNNIES,16,1/16/2011 16:25,0.65,15673,United Kingdom
541266,22616,PACK OF 12 LONDON TISSUES ,12,1/16/2011 16:25,0.29,15673,United Kingdom
541266,21985,PACK OF 12 HEARTS DESIGN TISSUES ,12,1/16/2011 16:25,0.29,15673,United Kingdom
541266,22900, SET 2 TEA TOWELS I LOVE LONDON ,20,1/16/2011 16:25,2.95,15673,United Kingdom
541266,22898,CHILDRENS APRON APPLES DESIGN,8,1/16/2011 16:25,1.95,15673,United Kingdom
541266,22629,SPACEBOY LUNCH BOX ,2,1/16/2011 16:25,1.95,15673,United Kingdom
541266,22315,200 RED + WHITE BENDY STRAWS,12,1/16/2011 16:25,1.25,15673,United Kingdom
541266,22148,EASTER CRAFT 4 CHICKS ,6,1/16/2011 16:25,1.95,15673,United Kingdom
541266,22180,RETROSPOT LAMP,1,1/16/2011 16:25,9.95,15673,United Kingdom
541266,22988,SOLDIERS EGG CUP ,12,1/16/2011 16:25,1.25,15673,United Kingdom
541266,22988,SOLDIERS EGG CUP ,12,1/16/2011 16:25,1.25,15673,United Kingdom
541266,21755,LOVE BUILDING BLOCK WORD,1,1/16/2011 16:25,5.95,15673,United Kingdom
541266,21755,LOVE BUILDING BLOCK WORD,1,1/16/2011 16:25,5.95,15673,United Kingdom
541266,21755,LOVE BUILDING BLOCK WORD,1,1/16/2011 16:25,5.95,15673,United Kingdom
541266,21755,LOVE BUILDING BLOCK WORD,1,1/16/2011 16:25,5.95,15673,United Kingdom
541266,21755,LOVE BUILDING BLOCK WORD,1,1/16/2011 16:25,5.95,15673,United Kingdom
541266,21755,LOVE BUILDING BLOCK WORD,1,1/16/2011 16:25,5.95,15673,United Kingdom
541266,22411,JUMBO SHOPPER VINTAGE RED PAISLEY,10,1/16/2011 16:25,1.95,15673,United Kingdom
541266,21621,VINTAGE UNION JACK BUNTING,12,1/16/2011 16:25,8.5,15673,United Kingdom
541266,21621,VINTAGE UNION JACK BUNTING,13,1/16/2011 16:25,8.5,15673,United Kingdom
541266,21621,VINTAGE UNION JACK BUNTING,10,1/16/2011 16:25,8.5,15673,United Kingdom
